ID,IPA,POS,Alt form,Def,defFr,defDu,defEn,C1 IPA,C2 IPA,C1 Voicing,C2 Voicing,C1 place,C2 place,Homorganic,C1 Manner,C2 Manner,T-D,N-ND,D-ND,KP-K,T-N,T-ND,D-N
3222,ŋgete,(v.),,"détacher avec les dents. Met tanden iets afeten, ■—■ afknagen.",détacher avec les dents,"Met tanden iets afeten, ■—■ afknagen",,ŋg,t,voiced,voiceless,dor,cor,non-homorganic,ND,T,No,No,No,No,No,No,No
3223,ŋgete,(v. r.),,aplatir étendre ; être aplati. Plat uiteenslaan; opengeplat zijn.,aplatir étendre ; être aplati,Plat uiteenslaan; opengeplat zijn,,ŋg,t,voiced,voiceless,dor,cor,non-homorganic,ND,T,No,No,No,No,No,No,No
3224,ŋgɛ̀la̍,(s.),,bergeronette. Kwikstaart.,bergeronette,Kwikstaart,,ŋg,l,voiced,voiced,dor,other,non-homorganic,ND,other,No,No,No,No,No,No,No
3225,ŋgɛ’dɛ,(v.),,"épier, venir voir —, écouter en cachette. Komen afspieden, in het geniep toezien, — afluisteren.","épier, venir voir —, écouter en cachette","Komen afspieden, in het geniep toezien, — afluisteren",,ŋg,d',voiced,voiced,dor,cor,non-homorganic,ND,other,No,No,No,No,No,No,No
3226,ŋgɛ’dɛ,"(v., cfr.)",nzɛ’dɛ ,: cracher entre les dents. Tussen de tanden speken.,nzɛ’dɛ : cracher entre les dents,Tussen de tanden speken,,ŋg,d',voiced,voiced,dor,cor,non-homorganic,ND,other,No,No,No,No,No,No,No
3227,ŋgɛ̀ndɛ̍,(s.),,"chaise de branche fourchue, la base tournée en haut servant d’appui tête. Ligstoel van boommik, de takken dienen als poten, de stam als hoofdleuning.","chaise de branche fourchue, la base tournée en haut servant d’appui tête","Ligstoel van boommik, de takken dienen als poten, de stam als hoofdleuning",,ŋg,nd,voiced,voiced,dor,cor,non-homorganic,ND,ND,No,No,No,No,No,No,No
3228,ŋgɛ̀ndù,(s.),,emballage de rotins et cordes porté sur le dos. Verpakking uit rotanstengels en koorden.,emballage de rotins et cordes porté sur le dos,Verpakking uit rotanstengels en koorden,,ŋg,nd,voiced,voiced,dor,cor,non-homorganic,ND,ND,No,No,No,No,No,No,No
3230,ŋgɛmɛ,(v.),,"rassembler, amasser, porter ensemble. Vergaren, samenbrengen.","rassembler, amasser, porter ensemble","Vergaren, samenbrengen",,ŋg,m,voiced,voiced,dor,lab,non-homorganic,ND,N,No,Yes,No,No,No,No,No
3231,ŋgɛnzɛ,(v.),,"être craquant, — très sec, crépiter. Krakerig zijn.","être craquant, — très sec, crépiter",Krakerig zijn,,ŋg,nz,voiced,voiced,dor,other,non-homorganic,ND,other,No,No,No,No,No,No,No
3232,ŋgɛ̍nzɛ̍,(s.),,espèce de rongeur à poils épineux comme le hérisson. Knaagdier met stekels als egel (Atherurus).,espèce de rongeur à poils épineux comme le hérisson,Knaagdier met stekels als egel (Atherurus),,ŋg,nz,voiced,voiced,dor,other,non-homorganic,ND,other,No,No,No,No,No,No,No
3238,ŋgòko̍,(s.),,"matière purulente durcie, croûte de blessure. Ver' steven etter, roof op wonde.","matière purulente durcie, croûte de blessure","Ver' steven etter, roof op wonde",,ŋg,k,voiced,voiceless,dor,dor,homorganic,ND,T,No,No,No,No,No,No,No
3239,ŋgóló,(s. vx.),,long couteau se terminant en faucille. Houwmes eindigend op sikkel.,long couteau se terminant en faucille,Houwmes eindigend op sikkel,,ŋg,l,voiced,voiced,dor,other,non-homorganic,ND,other,No,No,No,No,No,No,No
3240,ŋgòlò,(s.),,"tisserin jaune commun, républicain. Republikein' vogeltje, gewoon wevervo geitje in de dorpen.","tisserin jaune commun, républicain","Republikein' vogeltje, gewoon wevervo geitje in de dorpen",,ŋg,l,voiced,voiced,dor,other,non-homorganic,ND,other,No,No,No,No,No,No,No
3241,ŋgo̍lo̍,(s.),ŋgóló lì ,", = : lisière boi- 4 sée entre l’eau et la plaine. ‘ Strook bos tussen water en grasland.",", = ŋgóló lì : lisière boi- 4 sée entre l’eau et la plaine",‘ Strook bos tussen water en grasland,,ŋg,l,voiced,voiced,dor,other,non-homorganic,ND,other,No,No,No,No,No,No,No
3242,ŋgóŋgò,(s. étr.),,bambou. Bamboe.,bambou,Bamboe,,ŋg,ŋg,voiced,voiced,dor,dor,homorganic,ND,ND,No,No,No,No,No,No,No
3243,ŋgo̍to̍,(s.),,petit pigeon des champs beige rosé. Tortelduifje. (Turtur af er).,petit pigeon des champs beige rosé,Tortelduifje,,ŋg,t,voiced,voiceless,dor,cor,non-homorganic,ND,T,No,No,No,No,No,No,No
3248,ŋgùbù,(s.),,hippopotame. Nijl- .v paard.,,,,ŋg,b,voiced,voiced,dor,lab,non-homorganic,ND,D,No,No,Yes,No,No,No,No
3249,ŋgù’dù-,(s.),,"poitrine -; côté bombé de qc. Borst, borstkas; 'ge- bogenstaande kant.",poitrine -; côté bombé de qc,"Borst, borstkas; 'ge- bogenstaande kant",,ŋg,d',voiced,voiced,dor,cor,non-homorganic,ND,other,No,No,No,No,No,No,No
3250,ŋgùkú,(s.),,boîte ronde en. écorce. Doos uit boomschors.,boîte ronde en,écorce,,ŋg,k,voiced,voiceless,dor,dor,homorganic,ND,T,No,No,No,No,No,No,No
3251,ŋgu̍la̍,(s.),,"arbre hôte des anaphes •; chenille anaphe à nid commun, donnant la soiè d’anaphe. Boom zonder waarde door de anaphe- ruspen gezocht; anapheruspen die een soort zijdraad leveren.","arbre hôte des anaphes •; chenille anaphe à nid commun, donnant la soiè d’anaphe",Boom zonder waarde door de anaphe- ruspen gezocht; anapheruspen die een soort zijdraad leveren,,ŋg,l,voiced,voiced,dor,other,non-homorganic,ND,other,No,No,No,No,No,No,No
3252,ŋgúmbá,(s.),,manche crochu de houe. SteeT van hak in haak- vorpi.,manche crochu de houe,SteeT van hak in haak- vorpi,,ŋg,mb,voiced,voiced,dor,lab,non-homorganic,ND,ND,No,No,No,No,No,No,No
3253,ŋgùmbè,(s. étr.),,fusil. Geweer.,fusil,Geweer,,ŋg,mb,voiced,voiced,dor,lab,non-homorganic,ND,ND,No,No,No,No,No,No,No
3255,ŋgùŋge̍,(s.),,"buisson à écorce ■ fibreuse ; liens d’écorce ngürige. Struik met vezelachtige schors; schorskoorden van.ngunge.,",buisson à écorce ■ fibreuse ; liens d’écorce ngürige,Struik met vezelachtige schors; schorskoorden van,,ŋg,ŋg,voiced,voiced,dor,dor,homorganic,ND,ND,No,No,No,No,No,No,No
3256,ŋgutu,(v.),,"roussir, brûler,; être roussi, -— brûlé. Verzengen, aanbranden; verschwoid “—, aangebrand zijn. .",,,,ŋg,t,voiced,voiceless,dor,cor,non-homorganic,ND,T,No,No,No,No,No,No,No
3258,ŋmana,(v.),,"tendre, étirer, extraire en tirant. Spannen, uitrekken ; tussenuittrekken.","tendre, étirer, extraire en tirant","Spannen, uitrekken ; tussenuittrekken",,ŋm,n,voiced,voiced,labdor,cor,non-homorganic,N,N,No,No,No,No,No,No,No
3279,pàlà,(s.),,"place, lieu ; temps. Plaats; tijd.","place, lieu ; temps",Plaats; tijd,,p,l,voiceless,voiced,lab,other,non-homorganic,T,other,No,No,No,No,No,No,No
3283,pã̀lî-,(s.),,"bile, fiel. Gai.","bile, fiel",Gai,,p,l,voiceless,voiced,lab,other,non-homorganic,T,other,No,No,No,No,No,No,No
3284,panda,"(v., cfr.)",’banda," : croiser, tresser en çroisant. Kruiselings _ overeen vlechten.","’banda : croiser, tresser en çroisant",Kruiselings _ overeen vlechten,,p,nd,voiceless,voiced,lab,cor,non-homorganic,T,ND,No,No,No,No,No,No,No
3285,pànde̍,(s.),,raphia. fRafia (vezels).,raphia,fRafia (vezels),,p,nd,voiceless,voiced,lab,cor,non-homorganic,T,ND,No,No,No,No,No,No,No
3286,pànzà,(s.),,"broche en bois, bâton- ■ net à embrocher. Houten priem.","broche en bois, bâton- ■ net à embrocher",Houten priem,,p,nz,voiceless,voiced,lab,other,non-homorganic,T,other,No,No,No,No,No,No,No
3288,paŋa,(v.),,"être sur, être amer. Zuur —, bitter zijn.","être sur, être amer","Zuur —, bitter zijn",,p,ŋ,voiceless,voiced,lab,dor,non-homorganic,T,N,No,No,No,No,Yes,No,No
3289,pàŋgá,(s.),,flèche à pointe de fer barbelée. Pijl met ijzeren ' punt en weerhaken.,flèche à pointe de fer barbelée,Pijl met ijzeren ' punt en weerhaken,,p,ŋg,voiceless,voiced,lab,dor,non-homorganic,T,ND,No,No,No,No,No,No,No
3292,pata,(v.),,"penser à, se souvenir de. Denken op, zich herinneren.","penser à, se souvenir de","Denken op, zich herinneren",,p,t,voiceless,voiceless,lab,cor,non-homorganic,T,T,No,No,No,No,No,No,No
3293,pende,(v.),,"croiser, mettre à travers ; être croisé, se trouver à travers. Kruiselings overeenleggen, dwars leggen; dwars liggen, gèkruisd zijn.","croiser, mettre à travers ; être croisé, se trouver à travers","Kruiselings overeenleggen, dwars leggen; dwars liggen, gèkruisd zijn",,p,nd,voiceless,voiced,lab,cor,non-homorganic,T,ND,No,No,No,No,No,No,No
3296,pɛlɛ,(v.),,"épousseter, passer sur (à coups répétés), enduire à coups répétés. Met kleine aanrakingen bestrijken, — afvegen, — afstoffen, — afslaan.","épousseter, passer sur (à coups répétés), enduire à coups répétés","Met kleine aanrakingen bestrijken, — afvegen, — afstoffen, — afslaan",,p,l,voiceless,voiced,lab,other,non-homorganic,T,other,No,No,No,No,No,No,No
3297,pɛ̍lɛ̍,(s.),,"corde, fil, lien ; liane, tige grimpante. Koord, draad, bindsel; slingerplant. •","corde, fil, lien ; liane, tige grimpante","Koord, draad, bindsel; slingerplant",,p,l,voiceless,voiced,lab,other,non-homorganic,T,other,No,No,No,No,No,No,No
3300,pɛpɛ,(v.),,"vanner, activer en faisant du vent. Wannen, aanwaaien.","vanner, activer en faisant du vent","Wannen, aanwaaien",,p,p,voiceless,voiceless,lab,lab,homorganic,T,T,No,No,No,No,No,No,No
3301,pɛsɛ,(v.),,"répandre, étendre, disperser ; se répandre, se disperser. Verspreiden, uiteenspreiden; zich verspreiden, uiteenlopen.","répandre, étendre, disperser ; se répandre, se disperser","Verspreiden, uiteenspreiden; zich verspreiden, uiteenlopen",,p,s,voiceless,voiceless,lab,other,non-homorganic,T,other,No,No,No,No,No,No,No
3302,pɛ́tá,(s.),,"objets rangés, — entassés régulièrement. Regelmatig geschikte of op gestapelde hoeveelheid.","objets rangés, — entassés régulièrement",Regelmatig geschikte of op gestapelde hoeveelheid,,p,t,voiceless,voiceless,lab,cor,non-homorganic,T,T,No,No,No,No,No,No,No
3309,pumbu,(v.),,"être vide, être creux. Loos zijn, ledig zijn.","être vide, être creux","Loos zijn, ledig zijn",,p,mb,voiceless,voiced,lab,lab,homorganic,T,ND,No,No,No,No,No,No,No
3313,pùndà,(s. étr.),,âne. Ezel.,âne,Ezel,,p,nd,voiceless,voiced,lab,cor,non-homorganic,T,ND,No,No,No,No,No,No,No
3314,pùnzà,(s.),," : poudre (comme médicament, fard, etc.). Poeder '(van schors, bladeren, enz.)",,,,p,nz,voiceless,voiced,lab,other,non-homorganic,T,other,No,No,No,No,No,No,No
3316,putu,"(v., cfr.)",futu," : effacer. Uitwrijven, effenwrijven, uitvagen.",futu : effacer,"Uitwrijven, effenwrijven, uitvagen",,p,t,voiceless,voiceless,lab,cor,non-homorganic,T,T,No,No,No,No,No,No,No
3323,"sa’ba,",(v.),,"tordre ; se tordre, être tordu. Wringen, omwringen; gewrongen zijn.","tordre ; se tordre, être tordu","Wringen, omwringen; gewrongen zijn",,s,b',voiceless,voiced,other,lab,non-homorganic,other,other,No,No,No,No,No,No,No
3324,sà’bà,(s.),,tenailles de forgeron. Smistang om ijzer te wringen.,tenailles de forgeron,Smistang om ijzer te wringen,,s,b',voiceless,voiced,other,lab,non-homorganic,other,other,No,No,No,No,No,No,No
3327,sà’dà,(s.),,"déchets, gousses vides, son, etc. Afval, zemelen, schelpen.","déchets, gousses vides, son, etc","Afval, zemelen, schelpen",,s,d',voiceless,voiced,other,cor,non-homorganic,other,other,No,No,No,No,No,No,No
3328,sà’dè,(s.),,"animal, bête ; viande, chair. Dier, beest; vlees (ook van vis).","animal, bête ; viande, chair","Dier, beest; vlees (ook van vis)",,s,d',voiceless,voiced,other,cor,non-homorganic,other,other,No,No,No,No,No,No,No
3329,saka,(v.),,"choisir, trier. Uitkiezen, uitlezen.",,,,s,k,voiceless,voiceless,other,dor,non-homorganic,other,T,No,No,No,No,No,No,No
3330,saka,(v.),,"être habile, — adroit, — judicieux. Knap- zijn, ver- standig zijn,. ■","être habile, — adroit, — judicieux","Knap- zijn, ver- standig zijn,",,s,k,voiceless,voiceless,other,dor,non-homorganic,other,T,No,No,No,No,No,No,No
3332,sàkpá,(s. étr.),,hotte portée sur le dos. Hoge mand die op rug gedragen wordt.,hotte portée sur le dos,Hoge mand die op rug gedragen wordt,,s,kp,voiceless,voiceless,other,labdor,non-homorganic,other,T,No,No,No,No,No,No,No
3333,sala,(s.),,"perforer, percer ; saillir, sortir à travers ; être perforé, — troué. Dootboren, dwars doorsteken ; dwarsdoor uitsteken ; doorboord zijn; dwarsdoor open zijn.","perforer, percer ; saillir, sortir à travers ; être perforé, — troué","Dootboren, dwars doorsteken ; dwarsdoor uitsteken ; doorboord zijn; dwarsdoor open zijn",,s,l,voiceless,voiced,other,other,homorganic,other,other,No,No,No,No,No,No,No
3334,sala,(v.),,"peigner, râteler, gratter. Kammen, rijven, scharrelen.","peigner, râteler, gratter","Kammen, rijven, scharrelen",,s,l,voiceless,voiced,other,other,homorganic,other,other,No,No,No,No,No,No,No
3335,sa̍la̍,(s.),,"poil, plume. Haar (niet hoofdhaar), pluim.","poil, plume","Haar (niet hoofdhaar), pluim",,s,l,voiceless,voiced,other,other,homorganic,other,other,No,No,No,No,No,No,No
3336,sa̍la̍,(s.),,"singe commun de la région. Gewone aap van de streek, met lange rosbruine staart (Cercopithecus ascanius).",singe commun de la région,"Gewone aap van de streek, met lange rosbruine staart (Cercopithecus ascanius)",,s,l,voiceless,voiced,other,other,homorganic,other,other,No,No,No,No,No,No,No
3337,sàlà,(s.),,"fourche, objet fourchu. Vork, mik.","fourche, objet fourchu","Vork, mik",,s,l,voiceless,voiced,other,other,homorganic,other,other,No,No,No,No,No,No,No
3338,sàlò,(s.),,grive. Lijster.,grive,Lijster,,s,l,voiceless,voiced,other,other,homorganic,other,other,No,No,No,No,No,No,No
3339,sámbá,(s.),,fleur mâle de palmier ; vin tiré du pédoncule de la fleur de palmier. Mannelijke palmbloem; wijn bekomen door wegsnijden der palmbloem.,fleur mâle de palmier ; vin tiré du pédoncule de la fleur de palmier,Mannelijke palmbloem; wijn bekomen door wegsnijden der palmbloem,,s,mb,voiceless,voiced,other,lab,non-homorganic,other,ND,No,No,No,No,No,No,No
3340,sàmbè,(s.),,liane vénéneuse ; poison d’épreuve fait de raclures des racines de cette liane. Giftige liaan ; schraapsel van wortels'dezer plant gemengd’in water en gedronken als giftproef (Strychnos Dewevrei).,liane vénéneuse ; poison d’épreuve fait de raclures des racines de cette liane,Giftige liaan ; schraapsel van wortels'dezer plant gemengd’in water en gedronken als giftproef (Strychnos Dewevrei),,s,mb,voiceless,voiced,other,lab,non-homorganic,other,ND,No,No,No,No,No,No,No
3341,sàŋà-,(s.),,"intervalle, espace intermédiaire ; entre, au milieu. Tussenruimte, tussenlijd ; tussen, in tweeën.","intervalle, espace intermédiaire ; entre, au milieu","Tussenruimte, tussenlijd ; tussen, in tweeën",,s,ŋ,voiceless,voiced,other,dor,non-homorganic,other,N,No,No,No,No,No,No,No
3342,saŋa,(v.),,relier les intervalles. Tussenruimten verbinden.,relier les intervalles,Tussenruimten verbinden,,s,ŋ,voiceless,voiced,other,dor,non-homorganic,other,N,No,No,No,No,No,No,No
3344,sanza,(v.),,"pousser des rejetons (arbres, buissons) ; se multiplier. W ortelscheuten maken, nieuwe loten schieten; zich vermenigvuldigen.","pousser des rejetons (arbres, buissons) ; se multiplier","W ortelscheuten maken, nieuwe loten schieten; zich vermenigvuldigen",,s,nz,voiceless,voiced,other,other,homorganic,other,other,No,No,No,No,No,No,No
3346,sáŋgì,(s.),,panier large et solide pour porter des fardeaux. Mand van sterk vlechtwerk om op hoofd te dragen.,panier large et solide pour porter des fardeaux,Mand van sterk vlechtwerk om op hoofd te dragen,,s,ŋg,voiceless,voiced,other,dor,non-homorganic,other,ND,No,No,No,No,No,No,No
3347,sáŋgò,(s.),,"ce qui s’ajoute au plat principal, sauce, viande, poisson, légumes. Bijspijs: saus, vlees, vis, groenten.","ce qui s’ajoute au plat principal, sauce, viande, poisson, légumes","Bijspijs: saus, vlees, vis, groenten",,s,ŋg,voiceless,voiced,other,dor,non-homorganic,other,ND,No,No,No,No,No,No,No
3348,sàpè,(s.),,"honte, confusion. Schaamte, verlegenheid.","honte, confusion","Schaamte, verlegenheid",,s,p,voiceless,voiceless,other,lab,non-homorganic,other,T,No,No,No,No,No,No,No
3349,sàso̍,(s. étr.),,"casserole. Metalen pot, kookpot.",casserole,"Metalen pot, kookpot",,s,s,voiceless,voiceless,other,other,homorganic,other,other,No,No,No,No,No,No,No
3353,sékpé,(s.),,"petit tamis pour farine, tamis pour bière. Meelzeefje, bierzeef.","petit tamis pour farine, tamis pour bière","Meelzeefje, bierzeef",,s,kp,voiceless,voiceless,other,labdor,non-homorganic,other,T,No,No,No,No,No,No,No
3361,sɛ́lɛ̀,(s.),,"lance, javelot. Lans, werpspies.","lance, javelot","Lans, werpspies",,s,l,voiceless,voiced,other,other,homorganic,other,other,No,No,No,No,No,No,No
3362,sɛlɛ,(v.),,"trancher (qc. de léger), enlever d’un seul coup. Doorkappen, afkappen (met een slag).",trancher (qc,"de léger), enlever d’un seul coup",,s,l,voiceless,voiced,other,other,homorganic,other,other,No,No,No,No,No,No,No
3363,sɛmbɛ,(v.),,élever un bord pour tasser plus haut. Rondom afboorden om hoger te stapelen.,élever un bord pour tasser plus haut,Rondom afboorden om hoger te stapelen,,s,mb,voiceless,voiced,other,lab,non-homorganic,other,ND,No,No,No,No,No,No,No
3364,sɛ̀mbɛ́,(s.),,"grand pot large sans rebord, terrine dans laquelle on sert le manger. Gróte stenen teil waarin hetf eten wordt opgediend.","grand pot large sans rebord, terrine dans laquelle on sert le manger",Gróte stenen teil waarin hetf eten wordt opgediend,,s,mb,voiceless,voiced,other,lab,non-homorganic,other,ND,No,No,No,No,No,No,No
3365,sɛnɛ,(v.),,"haïr, détester, ne pas tolérer. Haten, niet kunnen verdragen.","haïr, détester, ne pas tolérer","Haten, niet kunnen verdragen",,s,n,voiceless,voiced,other,cor,non-homorganic,other,N,No,No,No,No,No,No,No
3366,sɛŋgɛ,(v.),,"dépecer en fendant, détacher en fendant. Afsplijten, nevenafkappen.","dépecer en fendant, détacher en fendant","Afsplijten, nevenafkappen",,s,ŋg,voiceless,voiced,other,dor,non-homorganic,other,ND,No,No,No,No,No,No,No
3367,sɛ̀ŋgɛ̀,(s.),sɛ̀ŋgɛ̀lɛ̀ ; sɛ̍ŋgɛ̍ fɔ̀lɔ̀, : poils de la queue d’un éléphant. Haar van olifants- staart.,= sɛ̀ŋgɛ̀lɛ̀ ; sɛ̍ŋgɛ̍ fɔ̀lɔ̀ : poils de la queue d’un éléphant,Haar van olifants- staart,,s,ŋg,voiceless,voiced,other,dor,non-homorganic,other,ND,No,No,No,No,No,No,No
3368,sɛ̍sɛ̍,(s.),,espèce d’amarante cultivée comme légume. Amarante groenteplant.,espèce d’amarante cultivée comme légume,Amarante groenteplant,,s,s,voiceless,voiceless,other,other,homorganic,other,other,No,No,No,No,No,No,No
3370,sɛtɛ,(v.),,"couper en rasant, détacher à petits coups. Rakelings afkappen.","couper en rasant, détacher à petits coups",Rakelings afkappen,,s,t,voiceless,voiceless,other,cor,non-homorganic,other,T,No,No,No,No,No,No,No
3371,sɛ̍tɛ̍,(s. étr.),,clou. Spijker.,clou,Spijker,,s,t,voiceless,voiceless,other,cor,non-homorganic,other,T,No,No,No,No,No,No,No
3372,sɛ̀tò,(s.),,araignée. Spin.,araignée,Spin,,s,t,voiceless,voiceless,other,cor,non-homorganic,other,T,No,No,No,No,No,No,No
3373,Sɛ̀tò,(s.),,"Seto, esprit de forêt- et héros bouffon des contes : à . l’origine c’était l’araignée légendaire des contes Soudanais. Seto, de bosgeest en boertige fabelheld der Ngbaka, heeft zijn oorsprong in de spinfabels van Soedan.","Seto, esprit de forêt- et héros bouffon des contes : à",l’origine c’était l’araignée légendaire des contes Soudanais,,s,t,voiceless,voiceless,other,cor,non-homorganic,other,T,No,No,No,No,No,No,No
3377,siki,(v.),,"tourner (horizontalement). Draaien, omdraaien.",tourner (horizontalement),"Draaien, omdraaien",,s,k,voiceless,voiceless,other,dor,non-homorganic,other,T,No,No,No,No,No,No,No
3378,sìkò,(s.),,chimpansée/ Chimpan- zeaap.,chimpansée/ Chimpan- zeaap,,,s,k,voiceless,voiceless,other,dor,non-homorganic,other,T,No,No,No,No,No,No,No
3379,sìlà,(s.),," : foie ; (fig.) cœur. Lever ; (fig.) hart, gemoed.","hart, gemoed",,,s,l,voiceless,voiced,other,other,homorganic,other,other,No,No,No,No,No,No,No
3380,sìlì,(s.),,puce. Vlo.,puce,Vlo,,s,l,voiceless,voiced,other,other,homorganic,other,other,No,No,No,No,No,No,No
3381,sìli̍,(s.),sili tula,",  : son de maïs. Zemelen van maïs.",", sili tula : son de maïs",Zemelen van maïs,,s,l,voiceless,voiced,other,other,homorganic,other,other,No,No,No,No,No,No,No
3382,síndé,(s.),, : petit écureuil à raies claires sur le dos. Klein gestreept eekhoorntje (Tamiscus sp.)?,,,,s,nd,voiceless,voiced,other,cor,non-homorganic,other,ND,No,No,No,No,No,No,No
3383,si̍ndi̍,(s.),,"sésame. Sezaamplani, sezaamzaad (oliehoudend).",sésame,"Sezaamplani, sezaamzaad (oliehoudend)",,s,nd,voiceless,voiced,other,cor,non-homorganic,other,ND,No,No,No,No,No,No,No
3384,síndò,(s.),,espèce de concombre indigène. Inlandse komkom- r mer ‘'(Cucumis melo).,espèce de concombre indigène,Inlandse komkom- r mer ‘'(Cucumis melo),,s,nd,voiceless,voiced,other,cor,non-homorganic,other,ND,No,No,No,No,No,No,No
3385,sini,(v.),tɔɛ," : =  : lier côte à côte (des baguettes p. ex.), en croisant deux cordes. Neveneen- binden met twee koorden die malkander kruisen.",", en croisant deux cordes",Neveneen- binden met twee koorden die malkander kruisen,,s,n,voiceless,voiced,other,cor,non-homorganic,other,N,No,No,No,No,No,No,No
3388,soko,(v.),,"regarder attentivement, observer. Aankijken, nakijken.","regarder attentivement, observer","Aankijken, nakijken",,s,k,voiceless,voiceless,other,dor,non-homorganic,other,T,No,No,No,No,No,No,No
3389,solo,(v.),,s’accroupir. Hurken.,s’accroupir,Hurken,,s,l,voiceless,voiced,other,other,homorganic,other,other,No,No,No,No,No,No,No
3390,solo,(v.),,tendre ; être tendu. Doen spannen ; gespannen staan.,tendre ; être tendu,Doen spannen ; gespannen staan,,s,l,voiceless,voiced,other,other,homorganic,other,other,No,No,No,No,No,No,No
3405,sɔ̀kpã́,(s.),,envie de choses appétissantes. Lust naar iets lekkers.,envie de choses appétissantes,Lust naar iets lekkers,,s,kp,voiceless,voiceless,other,labdor,non-homorganic,other,T,No,No,No,No,No,No,No
3406,sɔkpɔ,(v.),,"pousser doucement, piler doucement. Stoten zonder geweld.","pousser doucement, piler doucement",Stoten zonder geweld,,s,kp,voiceless,voiceless,other,labdor,non-homorganic,other,T,No,No,No,No,No,No,No
3407,sɔ̍la̍,(s.),,étoile. Ster.,étoile,Ster,,s,l,voiceless,voiced,other,other,homorganic,other,other,No,No,No,No,No,No,No
3409,sɔlɔ,(v.),,"rapprocher, pousser ensemble, pousser sur place. Aanschuiven, bijeenduwen; zich uit dop ontwikkelen.","rapprocher, pousser ensemble, pousser sur place","Aanschuiven, bijeenduwen; zich uit dop ontwikkelen",,s,l,voiceless,voiced,other,other,homorganic,other,other,No,No,No,No,No,No,No
3410,sɔlɔ,(v.),sɔ̀lɔ̀ dò-, : être dû à sa propre faute. Te wijten zijn aan eigen schuld.,sɔ̀lɔ̀ dò- : être dû à sa propre faute,Te wijten zijn aan eigen schuld,,s,l,voiceless,voiced,other,other,homorganic,other,other,No,No,No,No,No,No,No
3411,sɔnzɔ,(v.),,se soucier de. Bezorgd zijn om.,se soucier de,Bezorgd zijn om,,s,nz,voiceless,voiced,other,other,homorganic,other,other,No,No,No,No,No,No,No
3412,sɔ̍ŋga̍,(s.),,"euphorbe candélabre, cultivée pour la pêche. Kandelaber euphorbe, gekweekt als Vis- bedwelmend gift.","euphorbe candélabre, cultivée pour la pêche","Kandelaber euphorbe, gekweekt als Vis- bedwelmend gift",,s,ŋg,voiceless,voiced,other,dor,non-homorganic,other,ND,No,No,No,No,No,No,No
3413,sɔ̀ŋgà,(s.),,pressoir d’huile consistant en un filet grossier contenant la pulpe des fruits de palmier et qui est tordu à l’aide d’un bâton. Oliepers bestaande uit net waarin het palm- vlees gewrongen wordt.,pressoir d’huile consistant en un filet grossier contenant la pulpe des fruits de palmier et qui est tordu à l’aide d’un bâton,Oliepers bestaande uit net waarin het palm- vlees gewrongen wordt,,s,ŋg,voiceless,voiced,other,dor,non-homorganic,other,ND,No,No,No,No,No,No,No
3415,sɔsɔ,(v.),,"tâcher d’attraper, — d’atteindre, chercher un point de mire. Zoeken ie grijpen, naar iets tasten, mikpunt zoeken.","tâcher d’attraper, — d’atteindre, chercher un point de mire","Zoeken ie grijpen, naar iets tasten, mikpunt zoeken",,s,s,voiceless,voiceless,other,other,homorganic,other,other,No,No,No,No,No,No,No
3416,sɔ̍sɔ̃̍,(s.),,"sucriers, petits oiseaux ressemblant aux colibris. Honingvo geitjes.","sucriers, petits oiseaux ressemblant aux colibris",Honingvo geitjes,,s,s,voiceless,voiceless,other,other,homorganic,other,other,No,No,No,No,No,No,No
3417,sɔ̀ti̍,(s.),,pointe extrême. Uiterste punt.,pointe extrême,Uiterste punt,,s,t,voiceless,voiceless,other,cor,non-homorganic,other,T,No,No,No,No,No,No,No
3419,sù’dì,(s.),,"vent, pet. Wind.","vent, pet",Wind,,s,d',voiceless,voiced,other,cor,non-homorganic,other,other,No,No,No,No,No,No,No
3420,su’du,(v.),,"lâcher un vent, peter. Wind laten.","lâcher un vent, peter",Wind laten,,s,d',voiceless,voiced,other,cor,non-homorganic,other,other,No,No,No,No,No,No,No
3421,sukpu,(v.),,"palper, tâter, sonder. Tasten, peilen.","palper, tâter, sonder","Tasten, peilen",,s,kp,voiceless,voiceless,other,labdor,non-homorganic,other,T,No,No,No,No,No,No,No
3422,sukpu,(v.),,"rincer. Spoelen, uitspoelen .",rincer,"Spoelen, uitspoelen",,s,kp,voiceless,voiceless,other,labdor,non-homorganic,other,T,No,No,No,No,No,No,No
3423,sulu,(v.),,mugir (de l’eau d’une cascade). Bruisen (van water).,mugir (de l’eau d’une cascade),Bruisen (van water),,s,l,voiceless,voiced,other,other,homorganic,other,other,No,No,No,No,No,No,No
3424,sulu,(v.),,"être faible, être timide. Zwak —, tenger zijn, niet moedig zijn.","être faible, être timide","Zwak —, tenger zijn, niet moedig zijn",,s,l,voiceless,voiced,other,other,homorganic,other,other,No,No,No,No,No,No,No
3425,sulu,(v.),,"cuire pour conserver, donner une première cuisson. Opkoken om te bewaren.","cuire pour conserver, donner une première cuisson",Opkoken om te bewaren,,s,l,voiceless,voiced,other,other,homorganic,other,other,No,No,No,No,No,No,No
